,lyrics
60," I, I was the game he would play He brought the clouds to my day Then like a ray of light You came my way one night Just one look and I knew You would make everything clear Make all the clouds disappear Put all your fears to rest Who do I love the best Don't you know, don't you know? You've got it all over him You got me over him Honey, it's true There's just you You must have been heaven-sent Hearing me call, you went out on a limb And you're all that he's not Just look what I've got 'Cause you've got it all Over him No, don't let him worry you so Once I met you, I let go Oh you can surely see You're so much more to me Just one look and I knew You would make everything clear Make all the clouds disappear You're better than all the rest Who do I love the best Don't you know, don't you know? You've got it all over him You got me over him Honey, it's true There's just you You must have been heaven-sent Hearing me call, you went out on a limb And you're all that he's not Just look what I've got 'Cause you've got it all All over him Honey, it's true There's just you You must have been heaven-sent Hearing me call, you went out on a limb And you're all that he's not Just look what I've got 'Cause you've got it all All over him Honey, it's true There's just you You must have been heaven-sent Hearing me call, you went out on a limb And you're all that he's not Just look what I've got 'Cause you've got it all Over him"
61," You know I'm one of a kind Boy, what's this I see Your girl, she looks just like me Blond hair and dressed to a T You tell me how can this be Does she knew I was the one Who used to turn you on But you don't want to talk about it Well, you think you can find Someone to fill my shoes And you ask yourself why She don't do the things I do And you can't deny That everywhere you go You see my face, hear my name And it eats you up inside You know I'm one of a kind There'll never be another me Can't get me out of your mind You're lost in your own fantasy And when you look in my eyes Is it hard for you to realize She'll never be me Why can't you see it, girl Got no identity Whenever he's touching you He's really thinking of me Do you know I was the one Who used to turn him on? But you don't want to talk about it Well, you think you can find Someone to fill my shoes And you ask yourself why She don't do the things I do And you can't deny That everywhere you go You see my face, hear my name And it eats you up inside You know I'm one of a kind There'll never be another me Can't get me out of your mind You're lost in your own fantasy And when you look in my eyes Is it hard for you to realize She'll never be me You know I'm one of a kind There'll never be another me Can't get me out of your mind You're lost in your own fantasy And when you look in my eyes Is it hard for you to realize She'll never be me"
62," Big fat bass The big fat bass Big fat bass The big fat bass Big fat bass The big fat bass Big fat bass The big fat bass Big fat bass The big fat bass Big fat bass The big fat bass Big fat bass The big fat bass I can be the trouble, baby You can be the bass You can be the bass You can be the bass I can be the trouble, baby You can be the bass You can be the bass You can be the bass I can be the trouble, baby You can be the bass You can be the bass You can be the bass I can be the trouble, baby You can be the bass You can be the bass You can be the bass Hey, you see me down on the floor I want you to take me higher 'Til I can't take it no more It's gettin' bigger The bass is gettin' bigger And now, you see me up in the sky I was rockin' the bottom Now look at me I can fly It's gettin' bigger The bass is gettin' bigger I can be your trouble, baby You can be my bass You can be my bass You can be my bass I can be your trouble, baby You can be my bass You can be my bass You can be my bass It's gettin' bigger The bass is gettin' bigger It's gettin' bigger The bass is gettin' bigger It's gettin' bigger The bass is gettin' bigger It's gettin' bigger Bigger, bigger The bass is getting low The bass is getting low The bass is getting low It's gettin' bigger The bass is gettin' bigger Hey, you see me out in the night Wanna go out dancing So I can feel alright It's gettin' bigger The bass is gettin' bigger Yo, take me out in the lights I wanna have me a good time The bass is feelin' nice It's gettin' bigger The bass is gettin' bigger I can be your trouble, baby You can be my bass You can be my bass You can be my bass I can be your trouble, baby You can be my bass You can be my bass You can be my bass I can be your trouble, baby You can be my bass You can be my bass You can be my bass I can be your trouble, baby You can be my bass You can be my bass You can be my bass Yeah, yeah, yeah Y'all better get ready for the kick drum For the kick drum For the kick drum Y'all better get ready for the kick drum For the kick drum For the kick drum Yo it's the kick drum Come and get some Of the sound that's rockin' your system When it pounds it cause an addiction You addicts better have a prescription Me and Brit got the whole club trippin' They sit and wait and listen For the kick drum For the kick drum For the kick drum For the kick drum For the big big fat fat bass Rockin' all in your face Vibrate shake up the place Right now let's get crazy Here we go, here we go, here we go Everybody in the place get frantic This beat right here's gigantic Yo It's gettin' bigger The bass is gettin' bigger It's gettin' bigger The bass is gettin' bigger It's gettin' bigger The bass is gettin' bigger It's gettin' bigger The bass is gettin' bigger I can be your trouble baby You can be my bass You can be my bass You can be my bass I can be your trouble, baby You can be my bass You can be my bass You can be my bass I can be your trouble, baby You can be my bass You can be my bass You can be my bass I can be your trouble, baby You can be my bass You can be my bass Don't say it"
63," You don't have to look like a movie star Ooh I think you're good just the way you are Tell me if you could would you up and run away, with me? You don't have to roll like a millionaire Baby I would go with you anywhere We don't need no gold, we'll be shining anyway, we'll see You know can nobody get down like us We don't fuck 'till we get enough C'mon, turn it up 'till the speakers pop Break it down, show me what you got Ooh my my baby don't be shy I see that spark flashing in your eye My heart beats fast 'cause I want it all So baby come with me and be my ooh la la Take my hand, we can go all night And spin me round just the way I like It feels so good, I don't wanna stop So baby come with me and be my ooh la la You don't have to wear no designer clothes Just as long as we're dancing on the floor Fingers in my hair and I'm letting go tonight, so free You know can nobody get down like us We don't fuck 'till we get enough C'mon, turn it up 'till the speakers pop Break it down, show me what you got Ooh my my baby don't be shy I see that spark flashing in your eye My heart beats fast 'cause I want it all So baby come with me and be my ooh la la Take my hand, we can go all night And spin me round just the way I like It feels so good, I don't wanna stop So baby come with me and be my ooh la la (Be my ooh la la) Ooh my my baby don't be shy I see that spark flashing in your eye Ooh my my baby don't be shy I see that spark flashing in your eye My heart beats fast 'cause I want it all So baby come with me and be my ooh la la Take my hand, we can go all night And spin me round just the way I like It feels so good, I don't wanna stop So baby come with me and be my ooh la la Baby come with me and be my ooh la la So baby come with me and be my ooh la la"
64," I need time (time) Love (love), joy (joy) I need space (love) I need me (Action!) Say hello to the girl that I am You're going to have to see through my perspective I need to make mistakes just to learn who I am And I don't want to be so damn protected There must be another way Cause I believe in taking chances But who am I to say What a girl is to do? God, I need some answers What am I to do with my life? (You will find it out don't worry) How am I supposed to know what's right? (You just got to do it your way) I can't help the way I feel But my life has been so overprotected I'll tell them what I like, what I want, what I don't But every time I do I stand corrected Things that I've been told I can't believe what I hear about the world, I realize I'm overprotected There must be another way Cause I believe in taking chances But who am I to say What a girl is to do? God, I need some answers What am I to do with my life? (You will find it out don't worry) How am I supposed to know what's right? (You just got to do it your way) I can't help the way I feel But my life has been so overprotected I need time (love) I need space (This is it, this is it) I don't need nobody telling me just what I wanna What I, what, what, what I'm going to Do about my destiny I say no, no, nobody's telling me just What, what, what I wanna do, do I'm so fed up with people telling me to be Someone else but me (Action!) What am I to do with my life? (You will find it out don't worry) How am I supposed to know what's right? (You just got to do it your way) I can't help the way I feel But my life has been so overprotected I don't need nobody telling me just what I wanna What I, what, what, what I'm going to Do about my destiny I say no, no, nobody's telling me just What, what, what I wanna do, do I'm so fed up with people telling me to be Someone else but me What am I to do with my life? (You will find it out don't worry) How am I supposed to know what's right? (You just got to do it your way) I can't help the way I feel But my life has been so overprotected"
65," Got those heels on that you love The ones that drive you crazy Exactly what you're dreaming of I'll give it to you baby 150 miles away Singing out my lungs Driving fast all through L.A On my, my tongue Heart's beating fast When I'm turning the key I see you on your back And I just can't believe She looks just like me, just like me No, I just can't believe She looks just like me, just like me Just like me, ooh Before I think, I start to run But you can't even face me Know exactly what you've done Know exactly, baby Pictures, they flash And I can't even sleep I see you on your back And I just can't believe She looks just like me, just like me No, I just can't believe She looks just like me, just like me Just like me, ooh She can, she can, she can have you She can, she can, she can have you She can, she can, she can have you She can, she can, she can Pictures, they flash And I can't even sleep I see you on your back And I just can't believe She looks just like me, just like me No, I just can't believe She looks just like me, just like me Just like me, just like me"
66," There's only two types of people in the world The ones that entertain and the ones that observe Well baby, I'm a put-on-a-show kind of girl Don't like the backseat, gotta be first I'm a like the ringleader, I call the shots (Call the shots) I'm like a firecracker I make it hot, hot, hot, hot a firecracker I make it hot, hot, hot, hot a firecracker I make it hot, hot, hot, hot There's only two types of people in the world The ones that entertain and the ones that observe Well baby, I'm a put-on-a-show kind of girl Don't like the backseat, gotta be first I'm a like the ringleader, I call the shots (Call the shots) I'm like a firecracker I make it hot, hot, hot, hot I'm a like the ringleader, I call the shots (Call the shots) I'm like a firecracker I make it hot, hot, hot, hot All eyes on me in the center of the ring just like a circus When I crack that whip, everybody gon' trip just like a circus Don't stand there watching me, follow me, show me what you can do Everybody let go, we can make a dance floor just like a circus There's only two types of guys out there Ones that can hang with me and ones that are scared So baby, I hope that you came prepared I run a tight ship so beware I'm a like the ringleader, I call the shots (Call the shots) I'm like a firecracker, I make it hot, hot, hot I'm a like the ringleader, I call the shots (Call the shots) I'm like a firecracker, I make it hot, hot, hot There's only two types of people in the world The ones that entertain and the ones that observe Well baby, I'm a put-on-a-show kind of girl Don't like the backseat, gotta be first I'm a like the ringleader, I call the shots (Call the shots) I'm like a firecracker I make it hot, hot, hot, hot I'm a like the ringleader, I call the shots (Call the shots) I'm like a firecracker I make it hot, hot, hot, hot All eyes on me in the center of the ring just like a circus When I crack that whip, everybody gon' trip just like a circus Don't stand there watching me, follow me, show me what you can do Everybody let go, we can make a dance floor just like a circus"
67," Yeah, I've been waiting for you So patiently And now you're here You're my answer Thank you Yeah I think you're my answer Here I go You're the answer All this time I've tried to find you I've been yearning You're the answer to the question that's been burning When they ask me who I love, you're the answer You're my answer Patiently I've waited for this day to finally come Knew someday, somehow, I would find that special one Someone perfect, someone true Someone that I knew was you Who can hold me tight Keep me warm through the night Who can wipe my tears When it's wrong, make it right Who can give me love until I'm satisfied Who's the one I need in my life You're the answer All this time I've tried to find you I've been yearning You're the answer to the question that's been burning When they ask me who I love You're the answer You're my answer Baby I'm underneath your spell Savor every moment that I have you to myself Put my loving to the test cause baby this is destiny Yeah, this is destiny Who can hold me tight Keep me warm through the night Who can wipe my tears When it's wrong, make it right Who can give me love until I'm satisfied You're the one I need in my life You're the answer All this time I've tried to find you I've been yearning You're the answer to the question that's been burning When they ask me who I love You're the answer You're my answer You're the answer All this time I've tried to find you I've been yearning You're the answer to the question that's been burning When they ask me who I love You're the answer You're my answer Who can hold me tight Keep me warm through the night Who can wipe my tears When it's wrong, make it right Who can give me love until I'm satisfied Who's the one I need in my life You're the answer All this time I've tried to find you I've been yearning You're the answer to the question that's been burning When they ask me who I love You're the answer You're my answer You're the answer You're my answer, you're my answer, you're my answer You're my answer"
68," La, la, la, la-la, la, la, la La, la, la, la-la, la, la, la La, la, la, la-la, la, la, la La, la, la, la-la, la, la, la Oh baby, baby, have you seen Amy tonight? Is she in the bathroom, is she smokin' up outside? (Oh!) Oh baby, baby, does she take a piece of lime For the drink that I'mma buy her, do you know just what she likes? (Oh!) Oh (Oh) Tell me have you seen her, cause I'm so (Oh) I can't get her off of my brain I just wanna go, to the party she gon' go Can't somebody take me home? Haha, hehe, haha, ho Love me, hate me Say what you want about me But all of the boys and all of the girls Are begging to if you seek Amy Love me, hate me But can't you see what I see? All of the boys and all of the girls Are begging to if you seek Amy (Love me, hate me) La, la, la, la-la, la, la, la La, la, la, la-la, la, la, la Amy told me that she's gonna meet me up I don't know where or when and now they're closin' up the club (Oh!) I've seen her once or twice before she knows my face But it's hard to see with all the people standin' in the way (Oh!) Oh (Oh) Tell me have you seen her, cause I'm so (Oh) I can't get her off of my brain I just wanna go, to the party she gon' go Can't somebody take me home? Haha, hehe, haha, ho Love me, hate me Say what you want about me But all of the boys and all of the girls Are begging to if you seek Amy Love me, hate me But can't you see what I see? All of the boys and all of the girls Are begging to if you seek Amy (Love me, hate me) Ohhhh, say what you want about me Ohhhh, but can't you see what I see? (Love me, hate me) Yeahh, say what you want about me (La, la, la, la-la, la, la, la) So tell me if you see her (Let me know what she was wearing and what she was like) Cause I've been waiting here forever (Let me know where she was going I don't mind) Oh baby, baby, if you seek Amy tonight (Oh!) Oh baby, baby, we'll do whatever you'll like Oh baby, baby, baby Oh baby, baby, baby... La, la, la, la-la, la, la, la La, la, la, la-la, la, la, la La, la, la, la-la, la, la, la La, la, la, la-la, la, la, la Love me, hate me Say what you want about me But all of the boys and all of the girls Are begging to if you seek Amy Love me, hate me But can't you see what I see? All of the boys and all of the girls Are begging to if you seek Amy Love me, hate me Say what you want about me (Yeaaaah) (La, la, la, la-la, la, la, la) (Yeah) Love me, hate me But can't you see what I see? All of the boys and all of the girls Are begging to if you seek Amy (Love me, hate me) Ohhhh, say what you want about me Ohhhh, but can't you see what I see? (Love me, hate me) Yeahh, say what you want about me All of the boys and all of the girls Are begging to if you seek Amy"
69," I'm Miss American Dream since I was seventeen Don't matter if I step on the scene Or sneak away to the Philippines They still gon' put pictures of my derriere in the magazine You want a piece of me? You want a piece of me I'm Miss bad media karma Another day another drama Guess I can't see no harm In working and being a mama And with a kid on my arm I'm still an exception And you want a piece of me I'm Mrs. Lifestyles of the rich and famous (You want a piece of me) I'm Mrs. Oh my God that Britney's shameless! (You want a piece of me) I'm Mrs. Extra! Extra! This just in (You want a piece of me) I'm Mrs. she's too big now she's too thin (You want a piece of me) I'm Mrs. 'You want a piece of me?' Tryin' and pissin' me off Well get in line with the paparazzi Who's flippin' me off Hopin' I'll resort to startin' havoc And end up settlin' in court Now are you sure you want a piece of me? I'm Mrs. 'Most likely to get on TV for strippin' on the streets' When getting the groceries, no, for real Are you kidding me? No wonder there's panic in the industry I mean please I'm Mrs. Lifestyles of the rich and famous (You want a piece of me) I'm Mrs. Oh my God that Britney's Shameless (You want a piece of me) I'm Mrs. Exta! Extra! this just in (You want a piece of me) I'm Mrs. she's too big now she's too thin (You want a piece of me) I'm Miss American Dream since I was 17 Don't matter if I step on the scene Or sneak away to the Philippines They still gon' put pictures of my derriere in the magazine You want a piece of me? You want a piece of me You want a piece of me? I'm Mrs. Lifestyles of the rich and famous (You want a piece of me) I'm Mrs. Oh my God that Britney's shameless! (You want a piece of me) I'm Mrs. Extra! Extra! this just in (You want a piece of me) I'm Mrs. she's too big now she's too thin (You want a piece of me) I'm Mrs. Lifestyles of the rich and famous (You want a piece of me) I'm Mrs. Oh my God that Britney's shameless! (You want a piece of me) I'm Mrs. Extra! Extra! this just in (You want a piece of me) I'm Mrs. she's too big now she's too thin (You want a piece of me) Oh yeah You want a piece of me"
70," Baby, can't you see I'm calling A guy like you should wear a warning It's dangerous I'm falling There's no escape I can't wait I need a hit Baby, give me it You're dangerous I'm loving it Too high Can't come down Losin' my head Spinnin' 'round and 'round Do you feel me now? Oh, The taste of your lips I'm on a ride You're toxic I'm slippin' under With a taste of a poison paradise I'm addicted to you Don't you know that you're toxic? And I love what you do Don't you know that you're toxic? It's getting late To give you up I took a sip From my devil's cup Slowly, it's taking over me Too high Can't come down It's in the air and it's all around Can you feel me now? Oh, Taste of your lips I'm on a ride You're toxic I'm slippin' under With the taste of a poison paradise I'm addicted to you Don't you know that you're toxic? And I love what you do Don't you know that you're toxic? Don't you know that you're toxic? (Oh, oh) Taste of your lips I'm on a ride You're toxic I'm slippin' under With a taste of a poison paradise I'm addicted to you Don't you know that you're toxic? With the taste of your lips I'm on a ride You're toxic I'm slippin' under With a taste of the poison paradise I'm addicted to you Don't you know that you're toxic? Intoxicate me now With your lovin' now I think I'm ready now I think I'm ready now Intoxicate me now With your lovin' now I think I'm ready now"
71," Let's undo all the distance From your guts down to your buttons And get lost in your existence What you, what you, what you wanna do? And if you wanna get real And if you wanna get honest Then baby you know the deal What you wanna do? Better open up 'Cause it feels much better When we open up for each other And I know Oh, oh, oh, oh, oh, oh When you know somebody Oh, oh, oh, oh, oh, oh And they know your body It's so much better Show me what's under your t-shirt And bare it like it's your first time You take it off like you never Like you've never been hurt Open up (open up) 'cause it feels much better (much better) When we open up (open up) for each other (for each other) And I know Oh, oh, oh, oh, oh, oh When you know somebody Oh, oh, oh, oh, oh, oh And they know your body It's so much better So good, so good, so damn, so good So damn, so good, so right, so good (yeah) So good, so good, so damn, so good So damn, so good, so right, so good When you know somebody, when you know somebody When you know somebody, when you know somebody When you know Oh, oh, oh, (oh-oh) oh, oh, oh (oh-oh) When you know somebody Oh, oh, oh, (oh-oh) oh, oh, oh (oh-oh) And they know your body Oh, oh, oh, (oh-oh) oh, oh, oh (oh-oh) When you know somebody Oh, oh, oh, (oh-oh) oh, oh, oh (oh-oh) And they know your body Oh, get to know my body Better and better Better and better Damn It's so much better"
72," He is a hustler, he's no good at all He is a loser, he's a bum, bum, bum, bum He lies, he bluffs, he's unreliable He is a sucker with a gun, gun, gun, gun I know you told me I should stay away I know you said he's just a dog astray He is a bad boy with a tainted heart And even I know this ain't smart But mama I'm in love with a criminal And this type of love isn't rational, it's physical Mama please don't cry, I will be alright All reason aside I just can't deny, I love the guy He is a villain by the devil's law He is a killer just for fun, fun, fun, fun That man's a snitch and unpredictable He's got no conscience, he got none, none, none, none All I know, should've let go, but no 'Cause he's a bad boy with a tainted heart And even I know this ain't smart But mama I'm in love with a criminal And this type of love isn't rational, it's physical Mama please don't cry, I will be alright All reason aside I just can't deny, I love that guy And he's got my name, Tattooed on his arm his lucky charm So I guess it's okay he's with me And I hear people talk Trying to make remarks keep us apart But I don't even hear I don't care 'Cause mama I'm in love with a criminal And this type of love isn't rational, it's physical Mama please don't cry, I will be alright All reason aside I just can't deny, I love the guy Mama I'm in love with a criminal And this type of love isn't rational, it's physical Mama please don't cry, I will be alright All reason aside I just can't deny, I love the guy"
73," Baby, I'm so into you You got that something, what can I do Baby, you spin me around Oh, the earth is moving, but I can't feel the ground Every time you look at me My heart is jumpin', it's easy to see Lovin' you means so much more More than anything I ever felt before You drive me crazy I just can't sleep I'm so excited, I'm in too deep Oh crazy But it feels alright Baby, thinkin' of you keeps me up all night Oh oh Tell me, you're so into me That I'm the only one you will see Tell me, I'm not in the blue, oh That I'm not wastin' my feelings on you Lovin' you means so much more More than anything I ever felt before You drive me crazy I just can't sleep I'm so excited, I'm in too deep Oh crazy But it feels alright Baby, thinkin' of you keeps me up all night Crazy I just can't sleep I'm so excited, I'm in too deep Crazy But it feels alright Every day and every night You drive me crazy (you drive me crazy, baby) I'm so excited, I'm in too deep Oh crazy (you make me feel alright) Baby, thinkin' of you keeps me up all night You drive me crazy (you drive me crazy, baby) Yeah Oh crazy (you make me feel alright) But it feels alright Baby, thinkin' of you keeps me up all night Baby, thinkin' of you keeps me up all night"
